{
  "version": "1.0.0",
  "generatedAt": "2026-01-01T20:22:58.101Z",
  "components": {
    "input": {
      "editions": ["core"],
      "status": "stable",
      "name": "Input"
    },
    "button": {
      "editions": ["core"],
      "status": "stable",
      "name": "Button"
    }
  },
  "editionHierarchy": {
    "core": [],
    "pro": ["core"],
    "enterprise": ["core", "pro"]
  }
}
